id_documento;tipo_pessoa;nome_razao;nome_fantasia;rg_ie;email;telefone;cep;endereco;numero;complemento;bairro;cidade;uf;categoria;limite_credito;status;data_cadastro
48.031.918/0001-24; JURIDICA; UASG 153039 - UNIVERSIDADE ESTADUAL PAULISTA; UNESP; ISENTO; licitacoes@unesp.br; (11) 5627-0200; 01001-900; Rua Quirino de Andrade;215; s/n; Centro; Sao Paulo; SP; CLIENTE; NADA; ATIVO; 13/02/2026
28.634.816/0001-23; JURIDICA; UASG 985917 - MUNICIPIO DE SAO PEDRO DA ALDEIA; PREFEITURA S P ALDEIA; ISENTO; licitacoes@pmspa.rj.gov.br; (22) 2621-1559; 28940-000; Rua Marques da Cruz;61; s/n; Centro; Sao Pedro da Aldeia; RJ; CLIENTE; NADA; ATIVO; 13/02/2026
46.525.480/0001-92; JURIDICA; UASG 989291 - MUNICIPIO DE SAO ROQUE; PREFEITURA SAO ROQUE; ISENTO; licitacoes@saoroque.sp.gov.br; (11) 4784-8500; 18130-000; Rua Sao Paulo;966; s/n; Centro; Sao Roque; SP; CLIENTE; NADA; ATIVO; 13/02/2026
46.524.909/0001-92; JURIDICA; UASG 989233 - MUNICIPIO DE SAO ROQUE; PREFEITURA SAO ROQUE; ISENTO; licitacoes@saoroque.sp.gov.br; (11) 4784-8500; 18130-970; Rua Sao Paulo;966; s/n; Taboao; Sao Roque; SP; CLIENTE; NADA; ATIVO; 13/02/2026
94.117.222/0001-78; JURIDICA; UASG 984835 - MUNICIPIO DE SAO SEBASTIAO DO CAI; PREFEITURA CAI; ISENTO; licitacoes@saosebastiaodocai.rs.gov.br; (51) 3635-2500; 95760-001; Rua Marechal Deodoro;430; s/n; Centro; Sao Sebastiao do Cai; RS; CLIENTE; NADA; ATIVO; 13/02/2026
46.523.231/0001-11; JURIDICA; UASG 989115 - MUNICIPIO DE SAO VICENTE; PREFEITURA S VICENTE; ISENTO; licitacoes@saovicente.sp.gov.br; (13) 3569-9000; 11310-910; Rua Frei Gaspar;384; s/n; Centro; Sao Vicente; SP; CLIENTE; NADA; ATIVO; 13/02/2026
46.524.562/0001-86; JURIDICA; UASG 153039 - UNESP CAMPUS SAO VICENTE; UNIVERSIDADE ESTADUAL; ISENTO; compras.sv@unesp.br; (13) 3569-7100; 11330-900; Praca Infante Dom Henrique; s/n; s/n; Parque Bitaru; Sao Vicente; SP; CLIENTE; NADA; ATIVO; 13/02/2026
89.812.666/0001-45; JURIDICA; UASG 984915 - MUNICIPIO DE SAPIRANGA; PREFEITURA SAPIRANGA; ISENTO; licitacoes@sapiranga.rs.gov.br; (51) 3599-9500; 93800-001; Avenida Joao Correa;793; s/n; Centro; Sapiranga; RS; CLIENTE; NADA; ATIVO; 13/02/2026
87.613.121/0001-18; JURIDICA; UASG 985203 - MUNICIPIO DE SAPIRANGA; PREFEITURA SAPIRANGA; ISENTO; licitacao@sapiranga.rs.gov.br; (51) 3599-1000; 93800-000; Avenida Joao Correa;793; s/n; Centro; Sapiranga; RS; CLIENTE; NADA; ATIVO; 13/02/2026
10.723.239/0002-26; JURIDICA; UASG 158451 - IFSUL CAMPUS SAPUCAIA DO SUL; INSTITUTO FEDERAL; ISENTO; compras@sapucaia.ifsul.edu.br; (51) 3452-9200; 93226-450; Avenida Copacabana;100; s/n; Piratini; Sapucaia do Sul; RS; CLIENTE; NADA; ATIVO; 13/02/2026
88.811.566/0001-44; JURIDICA; UASG 985017 - MUNICIPIO DE SAPUCAIA DO SUL; PREFEITURA SAPUCAIA; ISENTO; licitacoes@sapucaiadosul.rs.gov.br; (51) 3451-8000; 93220-001; Avenida Professor Ruben Bento Alves;150; s/n; Centro; Sapucaia do Sul; RS; CLIENTE; NADA; ATIVO; 13/02/2026
94.217.333/0001-89; JURIDICA; UASG 984837 - MUNICIPIO DE SAPUCAIA DO SUL; PREFEITURA SAPUCAIA; ISENTO; licitacoes@sapucaia.rs.gov.br; (51) 3451-8000; 93220-001; Avenida Ruben Bento Alves;150; s/n; Centro; Sapucaia do Sul; RS; CLIENTE; NADA; ATIVO; 13/02/2026
91.536.847/0001-22; JURIDICA; UASG 985153 - MUNICIPIO DE SAPUCAIA DO SUL; PREFEITURA SAPUCAIA; ISENTO; licitacoes@sapucaiadosul.rs.gov.br; (51) 3451-8000; 93220-640; Avenida Getulio Vargas;2511; s/n; Centro; Sapucaia do Sul; RS; CLIENTE; NADA; ATIVO; 13/02/2026
28.650.141/0001-28; JURIDICA; UASG 985885 - MUNICIPIO DE SAQUAREMA; PREFEITURA SAQUAREMA; ISENTO; licitacao@saquarema.rj.gov.br; (22) 2651-2254; 28990-000;Rua Coronel Madureira;77; s/n; Centro; Saquarema; RJ; CLIENTE; NADA; ATIVO; 13/02/2026
28.636.917/0001-78; JURIDICA; UASG 985919 - MUNICIPIO DE SAQUAREMA; PREFEITURA SAQUAREMA; ISENTO; licitacoes@saquarema.rj.gov.br; (22) 2651-2254; 28990-000; Rua Coronel Madureira;77; s/n; Centro; Saquarema; RJ; CLIENTE; NADA; ATIVO; 13/02/2026
76.205.403/0001-00; JURIDICA; UASG 987579 - MUNICIPIO DE SARANDI; PREFEITURA SARANDI; ISENTO; licitacao@sarandi.pr.gov.br; (44) 3264-8600; 87111-230; Rua Jose Bonifacio;1101; s/n; Centro; Sarandi; PR; CLIENTE; NADA; ATIVO; 13/02/2026
18.734.333/0001-23; JURIDICA; UASG 985015 - MUNICIPIO DE SARZEDO; PREFEITURA SARZEDO; ISENTO; licitacoes@sarzedo.mg.gov.br; (31) 3577-7600; 32450-000; Rua Evaristo Fernandes Sena;115; s/n; Centro; Sarzedo; MG; CLIENTE; NADA; ATIVO; 13/02/2026
28.521.508/0001-54; JURIDICA; UASG 153052 - UNIVERSIDADE FEDERAL RURAL DO RIO DE JANEIRO; UFRRJ; ISENTO; licitacao@ufrrj.br; (21) 2682-1210; 23890-000;Rodovia BR 465; km 07; Campus; Zona Rural; Seropedica; RJ; CLIENTE; NADA; ATIVO; 12/02/2026
28.638.018/0001-21; JURIDICA; UASG 985921 - MUNICIPIO DE SEROPEDICA; PREFEITURA SEROPEDICA; ISENTO; licitacoes@seropedica.rj.gov.br; (21) 2682-1102; 23851-490; BR-465; s/n; km 40; Santa Sofia; Seropedica; RJ; CLIENTE; NADA; ATIVO; 13/02/2026
27.174.069/0001-98; JURIDICA; UASG 982565 - MUNICIPIO DE SERRA; PREFEITURA SERRA; ISENTO; licitacoes@serra.es.gov.br; (27) 3291-2000; 29176-900; Rua Maestro Antonio Cicero;111; s/n; Centro; Serra; ES; CLIENTE; NADA; ATIVO; 13/02/2026
46.524.203/0001-29; JURIDICA; UASG 158123 - IFSP CAMPUS SERTAOZINHO; INSTITUTO FEDERAL; ISENTO; compras.srt@ifsp.edu.br; (16) 3946-1170; 14169-263; Rua Americo Ambrosio;269; s/n; Jardim Canaa; Sertaozinho; SP; CLIENTE; NADA; ATIVO; 13/02/2026
46.524.701/0001-71; JURIDICA; UASG 989213 - MUNICIPIO DE SERTAOZINHO; PREFEITURA SERTAOZINHO; ISENTO; licitacoes@sertaozinho.sp.gov.br; (16) 2105-1000; 14160-000; Rua Aprigio de Araujo;837; s/n; Centro; Sertaozinho; SP; CLIENTE; NADA; ATIVO; 13/02/2026
18.442.233/0001-01; JURIDICA; UASG 985111 - MUNICIPIO DE SETE LAGOAS; PREFEITURA 7 LAGOAS; ISENTO; licitacoes@setelagoas.mg.gov.br; (31) 3779-7000; 35700-001; Praca Wilson Tanure;163; s/n; Centro; Sete Lagoas; MG; CLIENTE; NADA; ATIVO; 13/02/2026
28.640.119/0001-76; JURIDICA; UASG 985923 - MUNICIPIO DE SILVA JARDIM; PREFEITURA S JARDIM; ISENTO; licitacoes@silvajardim.rj.gov.br; (22) 2668-1118; 28820-000; Praca Amaral Peixoto;46; s/n; Centro; Silva Jardim; RJ; CLIENTE; NADA; ATIVO; 13/02/2026
94.317.444/0001-90; JURIDICA; UASG 984839 - MUNICIPIO DE SOBRADINHO; PREFEITURA SOBRADINHO; ISENTO; licitacoes@sobradinho.rs.gov.br; (51) 3742-1200; 96900-001; Rua General Osorio;200; s/n; Centro; Sobradinho; RS; CLIENTE; NADA; ATIVO; 13/02/2026
46.523.215/0001-29; JURIDICA; UASG 989201 - MUNICIPIO DE SOROCABA; PREFEITURA SOROCABA; ISENTO; licitacoes@sorocaba.sp.gov.br; (15) 3238-2100; 18013-280; Avenida Engenheiro Carlos Reinaldo Mendes;3041; Paco Municipal; Alem Ponte; Sorocaba; SP; CLIENTE; NADA; ATIVO; 13/02/2026
46.524.603/0001-34; JURIDICA; UASG 153039 - UNESP CAMPUS SOROCABA; UNIVERSIDADE ESTADUAL; ISENTO; compras.sor@unesp.br; (15) 3238-3400; 18087-180; Avenida Tres de Marco;511; s/n; Aparecidinha; Sorocaba; SP; CLIENTE; NADA; ATIVO; 13/02/2026
46.523.669/0001-42; JURIDICA; UASG 989151 - MUNICIPIO DE SUMARE; PREFEITURA SUMARE; ISENTO; licitacoes@sumare.sp.gov.br; (19) 3399-5100; 13170-001; Rua Dom Barreto;1303; s/n; Centro; Sumare; SP; CLIENTE; NADA; ATIVO; 13/02/2026
46.523.280/0001-54; JURIDICA; UASG 989202 - MUNICIPIO DE SUMARE; PREFEITURA SUMARE; ISENTO; licitacoes@sumare.sp.gov.br; (19) 3399-5100; 13170-001; Rua Dom Barreto;1303; s/n; Centro; Sumare; SP; CLIENTE; NADA; ATIVO; 13/02/2026
28.642.210/0001-10; JURIDICA; UASG 985925 - MUNICIPIO DE SUMIDOURO; PREFEITURA SUMIDOURO; ISENTO; licitacoes@sumidouro.rj.gov.br; (22) 2531-1128; 28637-000; Praca de Marins;11; s/n; Centro; Sumidouro; RJ; CLIENTE; NADA; ATIVO; 13/02/2026
46.525.842/0001-61; JURIDICA; UASG 989327 - MUNICIPIO DE SUZANO; PREFEITURA SUZANO; ISENTO; licitacoes@suzano.sp.gov.br; (11) 4745-2000; 08674-000; Rua Baruel;501; s/n; Centro; Suzano; SP; CLIENTE; NADA; ATIVO; 13/02/2026
45.124.344/0001-40; JURIDICA; UASG 989205 - MUNICIPIO DE SUZANO; PREFEITURA SUZANO; ISENTO; licitacoes@suzano.sp.gov.br; (11) 4745-2000; 08674-000; Rua Baruel;501; s/n; Centro; Suzano; SP; CLIENTE; NADA; ATIVO; 13/02/2026
46.523.644/0001-49; JURIDICA; UASG 989149 - MUNICIPIO DE TABOAO DA SERRA; PREFEITURA TABOAO; ISENTO; licitacoes@ts.sp.gov.br; (11) 4788-5300; 06753-900; Praca Miguel Ortega;286; s/n; Parque Assuncao; Taboao da Serra; SP; CLIENTE; NADA; ATIVO; 13/02/2026
20.566.555/0001-12; JURIDICA; UASG 984957 - MUNICIPIO DE TAIOBEIRAS; PREFEITURA TAIOBEIRAS; ISENTO; licitacoes@taiobeiras.mg.gov.br; (38) 3845-1200; 39550-000; Praca da Matriz; s/n; s/n; Centro; Taiobeiras; MG; CLIENTE; NADA; ATIVO; 13/02/2026
29.115.540/0001-81; JURIDICA; UASG 985911 - MUNICIPIO DE TANGUa; PREFEITURA TANGUa; ISENTO; licitacao@tangua.rj.gov.br; (21) 2747-1100; 24890-000;Rua Vereador Bento Rocha;130; s/n; Centro; Tangua; RJ; CLIENTE; NADA; ATIVO; 13/02/2026
28.644.311/0001-65; JURIDICA; UASG 985927 - MUNICIPIO DE TANGUA; PREFEITURA TANGUA; ISENTO; licitacoes@tangua.rj.gov.br; (21) 2739-1111; 24890-000; Rua Vereador Manoel de Macedo;1040; s/n; Centro; Tangua; RJ; CLIENTE; NADA; ATIVO; 13/02/2026
94.417.555/0001-01; JURIDICA; UASG 984841 - MUNICIPIO DE TAPEJARA; PREFEITURA TAPEJARA; ISENTO; licitacoes@tapejara.rs.gov.br; (54) 3344-4700; 99950-001; Rua do Comercio;1460; s/n; Centro; Tapejara; RS; CLIENTE; NADA; ATIVO; 13/02/2026
94.517.666/0001-12; JURIDICA; UASG 984843 - MUNICIPIO DE TAPES; PREFEITURA TAPES; ISENTO; licitacoes@tapes.rs.gov.br; (51) 3672-5200; 96190-001; Rua Coronel Pacheco;198; s/n; Centro; Tapes; RS; CLIENTE; NADA; ATIVO; 13/02/2026
92.114.999/0001-78; JURIDICA; UASG 985121 - MUNICIPIO DE TAQUARA; PREFEITURA TAQUARA; ISENTO; licitacoes@taquara.rs.gov.br; (51) 3541-9200; 95600-001; Rua Tristao Monteiro;1278; s/n; Centro; Taquara; RS; CLIENTE; NADA; ATIVO; 13/02/2026
46.525.300/0001-73; JURIDICA; UASG 989273 - MUNICIPIO DE TATUI; PREFEITURA TATUI; ISENTO; licitacoes@tatui.sp.gov.br; (15) 3259-8400; 18270-000; Avenida das Mangueiras;388; s/n; Centro; Tatui; SP; CLIENTE; NADA; ATIVO; 13/02/2026
46.523.560/0001-05; JURIDICA; UASG 989141 - MUNICIPIO DE TAUBATE; PREFEITURA TAUBATE; ISENTO; licitacoes@taubate.sp.gov.br; (12) 3625-5000; 12010-910; Avenida Tiradentes;520; s/n; Centro; Taubate; SP; CLIENTE; NADA; ATIVO; 13/02/2026
76.205.288/0001-72; JURIDICA; UASG 987601 - MUNICIPIO DE TELEMACO BORBA; PREFEITURA TELEMACO; ISENTO; licitacao@telemacoborba.pr.gov.br; (42) 3271-1000; 84261-300; Praca Dr. Horacio Klabin;37; s/n; Centro; Telemaco Borba; PR; CLIENTE; NADA; ATIVO; 13/02/2026
18.544.434/0001-01; JURIDICA; UASG 985311 - MUNICIPIO DE TEOFILO OTONI; PREFEITURA T OTONI; ISENTO; licitacoes@teofilootoni.mg.gov.br; (33) 3529-2200; 39800-001; Avenida Getulio Vargas;800; s/n; Centro; Teofilo Otoni; MG; CLIENTE; NADA; ATIVO; 13/02/2026
31.415.657/0001-30; JURIDICA; UASG 985913 - MUNICIPIO DE TERESOPOLIS; PREFEITURA TERESOPOLIS; ISENTO; licitacao@teresopolis.rj.gov.br; (21) 2742-3352; 25953-000;Avenida Feliciano Sodre;675; s/n; Varzea; TeresOpolis; RJ; CLIENTE; NADA; ATIVO; 13/02/2026
28.646.412/0001-00; JURIDICA; UASG 985929 - MUNICIPIO DE TERESOPOLIS; PREFEITURA TERESOPOLIS; ISENTO; licitacoes@teresopolis.rj.gov.br; (21) 2742-3352; 25953-000; Avenida Feliciano Sodre;675; s/n; Varzea; Teresopolis; RJ; CLIENTE; NADA; ATIVO; 13/02/2026
76.204.786/0001-11; JURIDICA; UASG 987533 - MUNICIPIO DE TERRA BOA; PREFEITURA TERRA BOA; ISENTO; licitacao@terraboa.pr.gov.br; (44) 3641-1133; 87240-000; Rua Teruo Sakuno;709; s/n; Centro; Terra Boa; PR; CLIENTE; NADA; ATIVO; 13/02/2026
94.617.777/0001-23; JURIDICA; UASG 984845 - MUNICIPIO DE TEUTONIA; PREFEITURA TEUTONIA; ISENTO; licitacoes@teutonia.rs.gov.br; (51) 3762-7700; 95890-001; Avenida 1 Leste;466; s/n; Centro; Teutonia; RS; CLIENTE; NADA; ATIVO; 13/02/2026
76.204.760/0001-63; JURIDICA; UASG 987535 - MUNICIPIO DE TIBAGI; PREFEITURA TIBAGI; ISENTO; licitacao@tibagi.pr.gov.br; (42) 3275-1233; 84300-000; Praca Edmundo Mercer;34; s/n; Centro; Tibagi; PR; CLIENTE; NADA; ATIVO; 13/02/2026
46.525.382/0001-63; JURIDICA; UASG 989281 - MUNICIPIO DE TIETE; PREFEITURA TIETE; ISENTO; licitacoes@tiete.sp.gov.br; (15) 3285-8755; 18530-000; Praca J. A. Correa;1; s/n; Centro; Tiete; SP; CLIENTE; NADA; ATIVO; 13/02/2026
76.205.684/0001-92; JURIDICA; UASG 987601 - MUNICIPIO DE TOLEDO; PREFEITURA TOLEDO; ISENTO; licitacao@toledo.pr.gov.br; (45) 3055-8800; 85900-240; Rua Raimundo Leonardi;1586; s/n; Centro; Toledo; PR; CLIENTE; NADA; ATIVO; 13/02/2026
78.206.300/0007-17; JURIDICA; UASG 154367 - UTFPR CAMPUS TOLEDO; UNIVERSIDADE FEDERAL; ISENTO; compras.td@utfpr.edu.br; (45) 3379-6800; 85902-490; Rua Cristo Rei;1900; s/n; Vila Becker; Toledo; PR; CLIENTE; NADA; ATIVO; 13/02/2026
92.815.777/0001-45; JURIDICA; UASG 985123 - MUNICIPIO DE TORRES; PREFEITURA TORRES; ISENTO; licitacoes@torres.rs.gov.br; (51) 3626-9100; 95560-001; Rua Jose Picoral;79; s/n; Centro; Torres; RS; CLIENTE; NADA; ATIVO; 13/02/2026
94.717.888/0001-34; JURIDICA; UASG 984847 - MUNICIPIO DE TORRES; PREFEITURA TORRES; ISENTO; licitacoes@torres.rs.gov.br; (51) 3626-9100; 95560-001; Rua Jose Picoral;79; s/n; Centro; Torres; RS; CLIENTE; NADA; ATIVO; 13/02/2026
28.648.513/0001-54; JURIDICA; UASG 985931 - MUNICIPIO DE TRAJANO DE MORAES; PREFEITURA TRAJANO; ISENTO; licitacoes@trajanodemoraes.rj.gov.br; (22) 2564-1102; 28750-000; Praca Waldemar Magalhaes; s/n; s/n; Centro; Trajano de Moraes; RJ; CLIENTE; NADA; ATIVO; 13/02/2026
92.915.888/0001-56; JURIDICA; UASG 985125 - MUNICIPIO DE TRAMANDAI; PREFEITURA TRAMANDAI; ISENTO; licitacoes@tramandai.rs.gov.br; (51) 3684-9000; 95590-001; Avenida da Igreja;346; s/n; Centro; Tramandai; RS; CLIENTE; NADA; ATIVO; 13/02/2026
20.677.666/0001-23; JURIDICA; UASG 984975 - MUNICIPIO DE TRES CORACOES; PREFEITURA 3 CORACOES; ISENTO; licitacoes@trescoracoes.mg.gov.br; (35) 3239-7100; 37410-000; Avenida Getulio Vargas;440; s/n; Centro; Tres Coracoes; MG; CLIENTE; NADA; ATIVO; 13/02/2026
94.817.999/0001-45; JURIDICA; UASG 984849 - MUNICIPIO DE TRES COROAS; PREFEITURA 3 COROAS; ISENTO; licitacoes@trescoroas.rs.gov.br; (51) 3546-7800; 95660-001; Avenida Santa Maria;120; s/n; Centro; Tres Coroas; RS; CLIENTE; NADA; ATIVO; 13/02/2026
94.918.111/0001-56; JURIDICA; UASG 984851 - MUNICIPIO DE TRES DE MAIO; PREFEITURA 3 MAIO; ISENTO; licitacoes@tresdemaio.rs.gov.br; (55) 3535-1100; 98910-001; Rua Minas Gerais;46; s/n; Centro; Tres de Maio; RS; CLIENTE; NADA; ATIVO; 13/02/2026
95.018.222/0001-67; JURIDICA; UASG 984853 - MUNICIPIO DE TRES PASSOS; PREFEITURA 3 PASSOS; ISENTO; licitacoes@trespassos.rs.gov.br; (55) 3522-0400; 98600-001; Avenida Santos Dumont;75; s/n; Centro; Tres Passos; RS; CLIENTE; NADA; ATIVO; 13/02/2026
20.788.777/0001-34; JURIDICA; UASG 984995 - MUNICIPIO DE TRES PONTAS; PREFEITURA 3 PONTAS; ISENTO; licitacoes@trespontas.mg.gov.br; (35) 3265-1122; 37190-000; Praca Presidente Vargas; s/n; s/n; Centro; Tres Pontas; MG; CLIENTE; NADA; ATIVO; 13/02/2026
28.521.508/0005-88; JURIDICA; UASG 153515 - UFRRJ CAMPUS TRES RIOS; UNIVERSIDADE FEDERAL; ISENTO; licitacao.tr@ufrrj.br; (24) 2251-7500; 25802-140;Avenida Alberto Lavinas;250; s/n; Centro; Tres Rios; RJ; CLIENTE; NADA; ATIVO; 13/02/2026
32.327.356/0001-15; JURIDICA; UASG 985915 - MUNICIPIO DE TReS RIOS; PREFEITURA TReS RIOS; ISENTO; licitacao@tresrios.rj.gov.br; (24) 2251-7400; 25802-200;Praca Sao Sebastiao;81; s/n; Centro; Tres Rios; RJ; CLIENTE; NADA; ATIVO; 13/02/2026
28.650.614/0001-09; JURIDICA; UASG 985933 - MUNICIPIO DE TRES RIOS; PREFEITURA TRES RIOS; ISENTO; licitacoes@tresrios.rj.gov.br; (24) 2252-1101; 25802-100; Praca Sao Sebastiao;81; s/n; Centro; Tres Rios; RJ; CLIENTE; NADA; ATIVO; 13/02/2026
95.118.333/0001-78; JURIDICA; UASG 984855 - MUNICIPIO DE TRIUNFO; PREFEITURA TRIUNFO; ISENTO; licitacoes@triunfo.rs.gov.br; (51) 3654-6200; 95840-001; Rua Bento Goncalves;124; s/n; Centro; Triunfo; RS; CLIENTE; NADA; ATIVO; 13/02/2026
46.524.629/0001-82; JURIDICA; UASG 153039 - UNESP CAMPUS TUPA; UNIVERSIDADE ESTADUAL; ISENTO; compras.tupa@unesp.br; (14) 3404-4200; 17602-496; Rua Domingos da Costa Lopes;780; s/n; Jardim Itaipu; Tupa; SP; CLIENTE; NADA; ATIVO; 13/02/2026
46.524.842/0001-96; JURIDICA; UASG 989227 - MUNICIPIO DE TUPA; PREFEITURA TUPA; ISENTO; licitacoes@tupa.sp.gov.br; (14) 3404-1000; 17600-000; Praca da Bandeira; s/n; s/n; Centro; Tupa; SP; CLIENTE; NADA; ATIVO; 13/02/2026
18.601.112/0001-23; JURIDICA; UASG 985315 - MUNICIPIO DE UBA; PREFEITURA UBA; ISENTO; licitacoes@uba.mg.gov.br; (32) 3301-6100; 36500-001; Praca Guido Marliere; s/n; s/n; Centro; Uba; MG; CLIENTE; NADA; ATIVO; 13/02/2026
18.401.123/0001-45; JURIDICA; UASG 985333 - MUNICIPIO DE UBERABA; PREFEITURA UBERABA; ISENTO; licitacoes@uberaba.mg.gov.br; (34) 3318-2000; 38010-100; Avenida Dom Luiz Maria Santana;141; s/n; Santa Marta; Uberaba; MG; CLIENTE; NADA; ATIVO; 13/02/2026
20.789.012/0001-33; JURIDICA; UASG 153036 - UNIVERSIDADE FEDERAL DO TRIANGULO MINEIRO; UFTM; ISENTO; compras@uftm.edu.br; (34) 3700-6000; 38010-140; Avenida Frei Paulino;30; s/n; Abadia; Uberaba; MG; CLIENTE; NADA; ATIVO; 13/02/2026
21.788.777/0001-23; JURIDICA; UASG 158151 - IF TRIANGULO MINEIRO; IFTM; ISENTO; compras@iftm.edu.br; (34) 3326-1100; 38064-190; Rua Vereador Bento Ferreira;160; s/n; Santa Marta; Uberaba; MG; CLIENTE; NADA; ATIVO; 13/02/2026
22.233.222/0001-67; JURIDICA; UASG 201013 - HOSPITAL CLINICAS UFTM; HC UFTM; ISENTO; compras@hc.uftm.edu.br; (34) 3318-5200; 38025-440; Rua Getulio Guarita;130; s/n; Abadia; Uberaba; MG; CLIENTE; NADA; ATIVO; 13/02/2026
18.414.128/0001-45; JURIDICA; UASG 985335 - MUNICIPIO DE UBERLANDIA; PREFEITURA UBERLANDIA; ISENTO; licitacoes@uberlandia.mg.gov.br; (34) 3239-2444; 38400-900; Avenida Anselmo Alves dos Santos;600; s/n; Santa Monica; Uberlandia; MG; CLIENTE; NADA; ATIVO; 13/02/2026
22.344.333/0001-78; JURIDICA; UASG 201014 - HOSPITAL CLINICAS UFU; HC UFU; ISENTO; compras@hc.ufu.br; (34) 3218-2100; 38405-315; Avenida Para;1720; s/n; Umuarama; Uberlandia; MG; CLIENTE; NADA; ATIVO; 13/02/2026
25.642.721/0001-60; JURIDICA; UASG 153115 - UNIVERSIDADE FEDERAL DE UBERLANDIA; UFU; ISENTO; licitacao@reito.ufu.br; (34) 3239-4411; 38400-902; Avenida Joao Naves de Avila;2121; Bloco 3P; Santa Monica; Uberlandia; MG; CLIENTE; NADA; ATIVO; 13/02/2026
76.205.486/0001-37; JURIDICA; UASG 987603 - MUNICIPIO DE UMURAMA; PREFEITURA UMUARAMA; ISENTO; licitacao@umuarama.pr.gov.br; (44) 3621-4141; 87501-050; Avenida Rio Branco;3717; s/n; Centro; Umuarama; PR; CLIENTE; NADA; ATIVO; 13/02/2026
20.899.888/0001-45; JURIDICA; UASG 985017 - MUNICIPIO DE UNAI; PREFEITURA UNAI; ISENTO; licitacoes@unai.mg.gov.br; (38) 3677-9600; 38610-000; Praca JK; s/n; s/n; Centro; Unai; MG; CLIENTE; NADA; ATIVO; 13/02/2026
76.204.984/0001-80; JURIDICA; UASG 987605 - MUNICIPIO DE UNIAO DA VITORIA; CAMARA MUNICIPAL; ISENTO; compras@uniaodavitoria.pr.leg.br; (42) 3522-1200; 84600-000; Rua Coronel Amazonas;498; s/n; Centro; Uniao da Vitoria; PR; CLIENTE; NADA; ATIVO; 13/02/2026
76.205.221/0001-38; JURIDICA; UASG 987603 - MUNICIPIO DE UNIAO DA VITORIA; PREFEITURA UNIAO; ISENTO; licitacao@uniaodavitoria.pr.gov.br; (42) 3521-1200; 84600-000; Rua Sete de Setembro;527; s/n; Centro; Uniao da Vitoria; PR; CLIENTE; NADA; ATIVO; 13/02/2026
00.394.452/0116-00; JURIDICA; UASG 784020 - DELEGACIA DA CAPITANIA DOS PORTOS EM URUGUAIANA; MARINHA DO BRASIL; ISENTO; licitacoes.deluga@marinha.mil.br; (55) 3412-2322; 97500-000; Rua Domingos de Almeida; s/n; s/n; Centro; Uruguaiana; RS; CLIENTE; NADA; ATIVO; 13/02/2026
00.394.460/0044-81; JURIDICA; UASG 200369 - DELEGACIA DE POLICIA FEDERAL EM URUGUAIANA; POLICIA FEDERAL; ISENTO; compras.uga.rs@pf.gov.br; (55) 3414-9000; 97500-510; Rua Santana;2467; s/n; Centro; Uruguaiana; RS; CLIENTE; NADA; ATIVO; 13/02/2026
89.212.000/0001-88; JURIDICA; UASG 985057 - MUNICIPIO DE URUGUAIANA; PREFEITURA URUGUAIANA; ISENTO; licitacoes@uruguaiana.rs.gov.br; (55) 3411-1800; 97500-001; Rua Santana;2467; s/n; Centro; Uruguaiana; RS; CLIENTE; NADA; ATIVO; 13/02/2026
87.593.026/0001-54; JURIDICA; UASG 985221 - MUNICIPIO DE URUGUAIANA; PREFEITURA URUGUAIANA; ISENTO; licitacao@uruguaiana.rs.gov.br; (55) 3411-1860; 97500-510; Rua Santana;2467; s/n; Centro; Uruguaiana; RS; CLIENTE; NADA; ATIVO; 13/02/2026
90.513.333/0001-12; JURIDICA; UASG 985119 - MUNICIPIO DE VACARIA; PREFEITURA VACARIA; ISENTO; licitacoes@vacaria.rs.gov.br; (54) 3231-6400; 95200-001; Rua Ramiro Barcelos;915; s/n; Centro; Vacaria; RS; CLIENTE; NADA; ATIVO; 13/02/2026
87.593.067/0001-40; JURIDICA; UASG 985223 - MUNICIPIO DE VACARIA; PREFEITURA VACARIA; ISENTO; licitacao@vacaria.rs.gov.br; (54) 3231-6400; 95200-000; Rua Ramiro Barcelos;915; s/n; Centro; Vacaria; RS; CLIENTE; NADA; ATIVO; 13/02/2026
28.652.715/0001-43; JURIDICA; UASG 985935 - MUNICIPIO DE VALENCA; PREFEITURA VALENCA; ISENTO; licitacoes@valenca.rj.gov.br; (24) 2453-2696; 27600-000; Rua Padre Manoel Gomes;20; s/n; Centro; Valenca; RJ; CLIENTE; NADA; ATIVO; 13/02/2026
46.524.686/0001-61; JURIDICA; UASG 989211 - MUNICIPIO DE VALINHOS; PREFEITURA VALINHOS; ISENTO; licitacoes@valinhos.sp.gov.br; (19) 3871-1211; 13270-000; Rua Antonio Carlos;301; s/n; Centro; Valinhos; SP; CLIENTE; NADA; ATIVO; 13/02/2026
46.525.547/0001-07; JURIDICA; UASG 989297 - MUNICIPIO DE VARGEM GRANDE PAULISTA; PREFEITURA VARGEM GRANDE; ISENTO; licitacoes@vargemgrandepaulista.sp.gov.br; (11) 4158-8800; 06730-000; Praca da Matriz;75; s/n; Centro; Vargem Grande Paulista; SP; CLIENTE; NADA; ATIVO; 13/02/2026
18.555.545/0001-23; JURIDICA; UASG 985355 - MUNICIPIO DE VARGINHA; PREFEITURA VARGINHA; ISENTO; licitacoes@varginha.mg.gov.br; (35) 3690-2000; 37002-000; Rua Julio Paulo Marcelini;50; s/n; Vila Paiva; Varginha; MG; CLIENTE; NADA; ATIVO; 13/02/2026
28.654.816/0001-98; JURIDICA; UASG 985937 - MUNICIPIO DE VARRE-SAI; PREFEITURA VARRE-SAI; ISENTO; licitacoes@varresai.rj.gov.br; (22) 3843-3451; 28375-000; Rua Felicissimo Faria Salgado;140; s/n; Centro; Varre-Sai; RJ; CLIENTE; NADA; ATIVO; 13/02/2026
28.513.232/0001-00; JURIDICA; UASG 985923 - MUNICIPIO DE VASSOURAS; PREFEITURA VASSOURAS; ISENTO; licitacao@vassouras.rj.gov.br; (24) 2471-7900; 27700-000;Rua Otavio Gomes;395; s/n; Centro; Vassouras; RJ; CLIENTE; NADA; ATIVO; 13/02/2026
28.656.917/0001-32; JURIDICA; UASG 985939 - MUNICIPIO DE VASSOURAS; PREFEITURA VASSOURAS; ISENTO; licitacoes@vassouras.rj.gov.br; (24) 2471-1104; 27700-000; Praca Barao de Campo Belo; s/n; s/n; Centro; Vassouras; RJ; CLIENTE; NADA; ATIVO; 13/02/2026
90.213.000/0001-89; JURIDICA; UASG 985115 - MUNICIPIO DE VENANCIO AIRES; PREFEITURA VENANCIO; ISENTO; licitacoes@venancioaires.rs.gov.br; (51) 3983-1000; 95800-001; Rua Osvaldo Aranha;1464; s/n; Centro; Venancio Aires; RS; CLIENTE; NADA; ATIVO; 13/02/2026
95.218.444/0001-89; JURIDICA; UASG 984857 - MUNICIPIO DE VERANOPOLIS; PREFEITURA VERANOPOLIS; ISENTO; licitacoes@veranopolis.rs.gov.br; (54) 3441-1477; 95330-001; Avenida Pinheiro Machado;770; s/n; Centro; Veranopolis; RS; CLIENTE; NADA; ATIVO; 13/02/2026
18.656.667/0001-23; JURIDICA; UASG 985351 - MUNICIPIO DE VESPASIANO; PREFEITURA VESPASIANO; ISENTO; licitacoes@vespasiano.mg.gov.br; (31) 3629-9700; 33200-001; Rua Dona Mariana da Costa;65; s/n; Centro; Vespasiano; MG; CLIENTE; NADA; ATIVO; 13/02/2026
91.693.531/0001-61; JURIDICA; UASG 985117 - MUNICIPIO DE VIAMAO; PREFEITURA VIAMAO; ISENTO; licitacoes@viamao.rs.gov.br; (51) 3485-0400; 94410-900; Praca Julio de Castilhos; s/n; s/n; Centro; Viamao; RS; CLIENTE; NADA; ATIVO; 13/02/2026
95.318.555/0001-90; JURIDICA; UASG 984859 - MUNICIPIO DE VIAMAO; PREFEITURA VIAMAO; ISENTO; licitacoes@viamao.rs.gov.br; (51) 3485-0400; 94410-001; Praca Julio de Castilhos; s/n; s/n; Centro; Viamao; RS; CLIENTE; NADA; ATIVO; 13/02/2026
88.000.898/0001-14; JURIDICA; UASG 985361 - MUNICIPIO DE VIAMAO; PREFEITURA VIAMAO; ISENTO; licitacoes@viamao.rs.gov.br; (51) 3492-7600; 94410-050; Praca Julio de Castilhos; s/n; s/n; Centro; Viamao; RS; CLIENTE; NADA; ATIVO; 13/02/2026
27.165.729/0001-51; JURIDICA; UASG 982581 - MUNICIPIO DE VIANA; PREFEITURA VIANA; ISENTO; licitacoes@viana.es.gov.br; (27) 2124-6700; 29130-000; Avenida Florentino Avidos;1; s/n; Centro; Viana; ES; CLIENTE; NADA; ATIVO; 13/02/2026
20.234.567/0001-88; JURIDICA; UASG 153035 - UNIVERSIDADE FEDERAL DE VICOSA; UFV; ISENTO; compras@ufv.br; (31) 3899-2100; 36570-900; Avenida Peter Henry Rolfs; s/n; Campus Universitario; Centro; Vicosa; MG; CLIENTE; NADA; ATIVO; 13/02/2026
21.011.000/0001-56; JURIDICA; UASG 985035 - MUNICIPIO DE VICOSA; PREFEITURA VICOSA; ISENTO; licitacoes@vicosa.mg.gov.br; (31) 3892-4100; 36570-000; Praca do Rosario;5; s/n; Centro; Vicosa; MG; CLIENTE; NADA; ATIVO; 13/02/2026
27.165.620/0001-14; JURIDICA; UASG 982563 - MUNICIPIO DE VILA VELHA; PREFEITURA VILA VELHA; ISENTO; licitacoes@vilavelha.es.gov.br; (27) 3149-7200; 29100-901; Avenida Santa Leopoldina;840; s/n; Coqueiral de Itaparica; Vila Velha; ES; CLIENTE; NADA; ATIVO; 13/02/2026
46.525.145/0001-59; JURIDICA; UASG 989257 - MUNICIPIO DE VINHEDO; PREFEITURA VINHEDO; ISENTO; licitacoes@vinhedo.sp.gov.br; (19) 3826-7800; 13280-000; Rua Humberto Pescarini;330; s/n; Centro; Vinhedo; SP; CLIENTE; NADA; ATIVO; 13/02/2026
21.122.111/0001-67; JURIDICA; UASG 985055 - MUNICIPIO DE VISCONDE DO RIO BRANCO; PREFEITURA V R BRANCO; ISENTO; licitacoes@vrb.mg.gov.br; (32) 3551-8100; 36520-000; Praca 28 de Setembro; s/n; s/n; Centro; Visconde do Rio Branco; MG; CLIENTE; NADA; ATIVO; 13/02/2026
27.080.571/0001-30; JURIDICA; ESTADO DO ESPIRITO SANTO; GOVERNO ES; ISENTO; compras@seger.es.gov.br; (27) 3636-5200; 29050-900; Avenida Governador Bley;236; s/n; Centro; Vitoria; ES; CLIENTE; NADA; ATIVO; 13/02/2026
27.142.058/0001-26; JURIDICA; UASG 982561 - MUNICIPIO DE VITORIA; PREFEITURA VITORIA; ISENTO; licitacoes@vitoria.es.gov.br; (27) 3382-6000; 29060-900; Avenida Marechal Mascarenhas de Moraes;1927; s/n; Bento Ferreira; Vitoria; ES; CLIENTE; NADA; ATIVO; 13/02/2026
