id_documento;tipo_pessoa;nome_razao;nome_fantasia;rg_ie;email;telefone;cep;endereco;numero;complemento;bairro;cidade;uf;categoria;limite_credito;status;data_cadastro
76.205.460/0001-99; JURIDICA; UASG 987473 - MUNICIPIO DE CAMBE; PREFEITURA CAMBE; ISENTO; licitacao@cambe.pr.gov.br; (43) 3174-0200; 86181-000; Rua Fadel Jose Moyses;100; s/n; Centro; Cambe; PR; CLIENTE; NADA; ATIVO; 13/02/2026
23.455.444/0001-78; JURIDICA; UASG 984147 - MUNICIPIO DE CAMBUI; PREFEITURA CAMBUI; ISENTO; licitacoes@cambui.mg.gov.br; (35) 3431-1200; 37600-000; Praca Coronel Justiniano;164; s/n; Centro; Cambui; MG; CLIENTE; NADA; ATIVO; 13/02/2026
23.566.555/0001-89; JURIDICA; UASG 984149 - MUNICIPIO DE CAMPESTRE; PREFEITURA CAMPESTRE; ISENTO; licitacoes@campestre.mg.gov.br; (35) 3743-1200; 37730-000; Praca Brasil; s/n; s/n; Centro; Campestre; MG; CLIENTE; NADA; ATIVO; 13/02/2026
76.204.646/0001-33; JURIDICA; UASG 987547 - MUNICIPIO DE CAMPINA GRANDE DO SUL; PREFEITURA CAMPINA; ISENTO; licitacao@pmcgs.pr.gov.br; (41) 3676-8000; 83430-000; Praca Bento Munhoz da Rocha Neto;30; s/n; Centro; Campina Grande do Sul; PR; CLIENTE; NADA; ATIVO; 13/02/2026
46.410.775/0001-36; JURIDICA; UASG 987515 - MUNICIPIO DE CAMPINAS; PREFEITURA CAMPINAS; ISENTO; licitacoes@campinas.sp.gov.br; (19) 2116-0100; 13026-901; Avenida Anchieta;200; Paco Municipal; Centro; Campinas; SP; CLIENTE; NADA; ATIVO; 13/02/2026
46.068.425/0001-33; JURIDICA; UASG 153038 - UNIVERSIDADE ESTADUAL DE CAMPINAS; UNICAMP; ISENTO; compras@unicamp.br; (19) 3521-7000; 13083-970; Cidade Universitaria Zeferino Vaz; s/n; s/n; Barao Geraldo; Campinas; SP; CLIENTE; NADA; ATIVO; 13/02/2026
18.822.111/0001-01; JURIDICA; UASG 984255 - MUNICIPIO DE CAMPO BELO; PREFEITURA C BELO; ISENTO; licitacoes@campobelo.mg.gov.br; (35) 3831-1300; 37270-000; Praca Oscar Botelho; s/n; s/n; Centro; Campo Belo; MG; CLIENTE; NADA; ATIVO; 13/02/2026
90.613.444/0001-23; JURIDICA; UASG 984357 - MUNICIPIO DE CAMPO BOM; PREFEITURA CAMPO BOM; ISENTO; licitacoes@campobom.rs.gov.br; (51) 3598-8600; 93700-001; Avenida Independencia;800; s/n; Centro; Campo Bom; RS; CLIENTE; NADA; ATIVO; 13/02/2026
87.613.568/0001-91; JURIDICA; UASG 984537 - MUNICIPIO DE CAMPO BOM; PREFEITURA CAMPO BOM; ISENTO; licitacao@campobom.rs.gov.br; (51) 3598-8600; 93700-000; Avenida Independencia;800; s/n; Centro; Campo Bom; RS; CLIENTE; NADA; ATIVO; 13/02/2026
76.205.544/0001-22; JURIDICA; UASG 987471 - MUNICIPIO DE CAMPO LARGO; PREFEITURA CAMPO LARGO; ISENTO; licitacao@campolargo.pr.gov.br; (41) 3291-5000; 83601-170; Avenida Padre Natal Pigatto;925; s/n; Vila Elizabeth; Campo Largo; PR; CLIENTE; NADA; ATIVO; 13/02/2026
76.205.387/0001-54; JURIDICA; UASG 987479 - MUNICIPIO DE CAMPO MOURAO; PREFEITURA CAMPO MOURAO; ISENTO; licitacao@campomourao.pr.gov.br; (44) 3518-1144; 87302-200; Rua Brasil;1487; s/n; Centro; Campo Mourao; PR; CLIENTE; NADA; ATIVO; 13/02/2026
78.206.300/0005-55; JURIDICA; UASG 154365 - UTFPR CAMPUS CAMPO MOURAO; UNIVERSIDADE FEDERAL; ISENTO; compras.cm@utfpr.edu.br; (44) 3518-1400; 87301-899; Via Rosalina Maria dos Santos;1233; s/n; Jardim Batel; Campo Mourao; PR; CLIENTE; NADA; ATIVO; 13/02/2026
08.411.050/0001-31; JURIDICA; UASG 158139 - IFF CAMPUS CAMPOS CENTRO; INSTITUTO FEDERAL; ISENTO; licitacao@iff.edu.br; (22) 2726-2800; 28060-010;Rua Dr. Siqueira;273; s/n; Parque Dom Bosco; Campos dos Goytacazes; RJ; CLIENTE; NADA; ATIVO; 13/02/2026
00.394.494/0003-06; JURIDICA; UASG 170015 - DELEGACIA DA RECEITA FEDERAL CAMPOS; RECEITA FEDERAL; ISENTO; licitacoes.cgp.rfb@rfb.gov.br; (22) 2733-1000; 28010-000;Rua Coronel Ponciano de Azevedo Furtado;47; s/n; Parque Santo Amaro; Campos dos Goytacazes; RJ; CLIENTE; NADA; ATIVO; 13/02/2026
00.394.460/0033-12; JURIDICA; UASG 200374 - DELEGACIA DE POLICIA FEDERAL EM CAMPOS; POLICIA FEDERAL; ISENTO; compras.cgp.rj@pf.gov.br; (22) 2726-8700; 28010-000;Rua Coronel Ponciano de Azevedo Furtado;47; s/n; Pq. Santo Amaro; Campos dos Goytacazes; RJ; CLIENTE; NADA; ATIVO; 13/02/2026
29.116.084/0001-31; JURIDICA; UASG 985739 - MUNICIPIO DE CAMPOS DOS GOYTACAZES; PREFEITURA CAMPOS; ISENTO; licitacao@campos.rj.gov.br; (22) 2733-3131; 28010-000;Rua Coronel Ponciano de Azevedo Furtado;47; s/n; Parque Santo Amaro; Campos dos Goytacazes; RJ; CLIENTE; NADA; ATIVO; 13/02/2026
28.503.242/0001-05; JURIDICA; UASG 985817 - MUNICIPIO DE CAMPOS DOS GOYTACAZES; PREFEITURA CAMPOS; ISENTO; licitacoes@campos.rj.gov.br; (22) 2733-3131; 28010-000; Rua Coronel Ponciano de Azevedo Furtado;47; s/n; Parque Santo Amaro; Campos dos Goytacazes; RJ; CLIENTE; NADA; ATIVO; 13/02/2026
96.419.777/0001-01; JURIDICA; UASG 984867 - MUNICIPIO DE CANDELARIA; PREFEITURA CANDELARIA; ISENTO; licitacoes@candelaria.rs.gov.br; (51) 3743-8100; 96930-000; Avenida Pereira Rego;1000; s/n; Centro; Candelaria; RS; CLIENTE; NADA; ATIVO; 13/02/2026
76.204.620/0001-95; JURIDICA; UASG 987549 - MUNICIPIO DE CANDIDO DE ABREU; PREFEITURA CANDIDO; ISENTO; licitacao@candidodeabreu.pr.gov.br; (42) 3476-1122; 84470-000; Avenida Visconde de Guarapuava;111; s/n; Centro; Candido de Abreu; PR; CLIENTE; NADA; ATIVO; 13/02/2026
93.116.111/0001-78; JURIDICA; UASG 984419 - MUNICIPIO DE CANELA; PREFEITURA CANELA; ISENTO; licitacoes@canela.rs.gov.br; (54) 3282-5100; 95680-001; Rua Dona Carlinda;455; s/n; Centro; Canela; RS; CLIENTE; NADA; ATIVO; 13/02/2026
87.613.154/0001-68; JURIDICA; UASG 984551 - MUNICIPIO DE CANELA; PREFEITURA CANELA; ISENTO; licitacao@canela.rs.gov.br; (54) 3282-5100; 95680-000; Rua Dona Carlinda;455; s/n; Centro; Canela; RS; CLIENTE; NADA; ATIVO; 13/02/2026
10.863.368/0004-83; JURIDICA; UASG 158461 - IFRS CAMPUS CANOAS; INSTITUTO FEDERAL; ISENTO; compras.canoas@ifrs.edu.br; (51) 3415-8200; 92412-240; Rua Dra. Maria Zelia Carneiro de Figueiredo;870; s/n; Igara; Canoas; RS; CLIENTE; NADA; ATIVO; 13/02/2026
87.892.003/0001-09; JURIDICA; UASG 984337 - MUNICIPIO DE CANOAS; PREFEITURA CANOAS; ISENTO; licitacoes@canoas.rs.gov.br; (51) 3462-1500; 92010-280; Rua Quinze de Janeiro;11; s/n; Centro; Canoas; RS; CLIENTE; NADA; ATIVO; 13/02/2026
89.048.458/0001-31; JURIDICA; UASG 984533 - MUNICIPIO DE CANOAS; PREFEITURA CANOAS; ISENTO; licitacao@canoas.rs.gov.br; (51) 3462-1500; 92010-260; Rua Quinze de Janeiro;11; s/n; Centro; Canoas; RS; CLIENTE; NADA; ATIVO; 13/02/2026
28.540.109/0001-11; JURIDICA; UASG 985819 - MUNICIPIO DE CANTAGALO; PREFEITURA CANTAGALO; ISENTO; licitacoes@cantagalo.rj.gov.br; (22) 2555-4201; 28500-000; Praca Miguel de Carvalho;65; s/n; Centro; Cantagalo; RJ; CLIENTE; NADA; ATIVO; 13/02/2026
93.015.999/0001-67; JURIDICA; UASG 984397 - MUNICIPIO DE CAPAO DA CANOA; PREFEITURA CAPAO; ISENTO; licitacoes@capaodacanoa.rs.gov.br; (51) 3995-1100; 95555-001; Avenida Paraguassu;1881; s/n; Centro; Capao da Canoa; RS; CLIENTE; NADA; ATIVO; 13/02/2026
23.677.666/0001-90; JURIDICA; UASG 984151 - MUNICIPIO DE CAPELINHA; PREFEITURA CAPELINHA; ISENTO; licitacoes@pmcapelinha.mg.gov.br; (33) 3516-1300; 39680-000; Avenida Tancredo Neves;10; s/n; Centro; Capelinha; MG; CLIENTE; NADA; ATIVO; 13/02/2026
76.204.604/0001-00; JURIDICA; UASG 987551 - MUNICIPIO DE CAPITAO LEONIDAS MARQUES; PREFEITURA CAPITAO; ISENTO; licitacao@capitaoleonidasmarques.pr.gov.br; (45) 3286-1122; 85790-000; Avenida Iguacu;111; s/n; Centro; Capitao Leonidas Marques; PR; CLIENTE; NADA; ATIVO; 13/02/2026
46.524.982/0001-64; JURIDICA; UASG 989241 - MUNICIPIO DE CARAGUATATUBA; PREFEITURA CARAGUA; ISENTO; licitacoes@caraguatatuba.sp.gov.br; (12) 3897-8100; 11660-900; Rua Luiz Passos Junior;50; s/n; Centro; Caraguatatuba; SP; CLIENTE; NADA; ATIVO; 13/02/2026
23.788.777/0001-01; JURIDICA; UASG 984153 - MUNICIPIO DE CARANDAI; PREFEITURA CARANDAI; ISENTO; licitacoes@carandai.mg.gov.br; (32) 3361-1122; 36280-000; Praca Barao de Santa Cecilia; s/n; s/n; Centro; Carandai; MG; CLIENTE; NADA; ATIVO; 13/02/2026
46.523.404/0001-44; JURIDICA; UASG 989125 - MUNICIPIO DE CARAPICUIBA; PREFEITURA CARAPICUIBA; ISENTO; licitacoes@carapicuiba.sp.gov.br; (11) 4164-5500; 06310-160; Rua Joaquim das Neves;205; s/n; Vila Caldas; Carapicuiba; SP; CLIENTE; NADA; ATIVO; 13/02/2026
18.833.222/0001-12; JURIDICA; UASG 984295 - MUNICIPIO DE CARATINGA; PREFEITURA CARATINGA; ISENTO; licitacoes@caratinga.mg.gov.br; (33) 3329-8000; 35300-000; Praca Cesario Alvim;1; s/n; Centro; Caratinga; MG; CLIENTE; NADA; ATIVO; 13/02/2026
90.813.666/0001-45; JURIDICA; UASG 984157 - MUNICIPIO DE CARAZINHO; PREFEITURA CARAZINHO; ISENTO; licitacoes@carazinho.rs.gov.br; (54) 3331-2699; 99500-001; Avenida Flores da Cunha;1264; s/n; Centro; Carazinho; RS; CLIENTE; NADA; ATIVO; 13/02/2026
87.612.982/0001-14; JURIDICA; UASG 984555 - MUNICIPIO DE CARAZINHO; PREFEITURA CARAZINHO; ISENTO; licitacao@carazinho.rs.gov.br; (54) 3331-2699; 99500-000; Avenida Flores da Cunha;1264; s/n; Centro; Carazinho; RS; CLIENTE; NADA; ATIVO; 13/02/2026
27.167.394/0001-23; JURIDICA; UASG 982567 - MUNICIPIO DE CARIACICA; PREFEITURA CARIACICA; ISENTO; licitacoes@cariacica.es.gov.br; (27) 3354-5800; 29140-900; Avenida Mario Gurgel;2502; s/n; Trevo de Alto Lage; Cariacica; ES; CLIENTE; NADA; ATIVO; 13/02/2026
23.899.888/0001-12; JURIDICA; UASG 984157 - MUNICIPIO DE CARMO DO CAJURU; PREFEITURA C CAJURU; ISENTO; licitacoes@carmodocajuru.mg.gov.br; (37) 3244-0700; 35557-000; Praca Primeiro de Janeiro;90; s/n; Centro; Carmo do Cajuru; MG; CLIENTE; NADA; ATIVO; 13/02/2026
24.011.000/0001-23; JURIDICA; UASG 984159 - MUNICIPIO DE CARMO DO RIO CLARO; PREFEITURA C R CLARO; ISENTO; licitacoes@carmodorioclaro.mg.gov.br; (35) 3561-2000; 37150-000; Rua Tito Carlos Pereira;11; s/n; Centro; Carmo do Rio Claro; MG; CLIENTE; NADA; ATIVO; 13/02/2026
00.394.502/0017-97; JURIDICA; UASG 120021 - JUSTICA FEDERAL CASCAVEL; JUSTICA FEDERAL; ISENTO; compras.cxu@jfpr.jus.br; (45) 3331-2020; 85816-013; Rua Parana;5000; s/n; Centro; Cascavel; PR; CLIENTE; NADA; ATIVO; 13/02/2026
01.442.222/0022-78; JURIDICA; UASG 160413 - 33 BATALHAO DE INFANTARIA MECANIZADO; EXERCITO BRASILEIRO; ISENTO; licitacoes.33bimtz@eb.mil.br; (45) 3225-1122; 85800-000; Avenida Manaus;1111; s/n; Centro; Cascavel; PR; CLIENTE; NADA; ATIVO; 13/02/2026
10.727.228/0005-75; JURIDICA; UASG 158476 - IFPR CAMPUS CASCAVEL; INSTITUTO FEDERAL; ISENTO; compras.cascavel@ifpr.edu.br; (45) 3333-2000; 85818-560; Avenida das Torres;1342; s/n; Tropical; Cascavel; PR; CLIENTE; NADA; ATIVO; 13/02/2026
75.425.614/0001-35; JURIDICA; UASG 987475 - MUNICIPIO DE CASCAVEL; PREFEITURA CASCAVEL; ISENTO; licitacao@cascavel.pr.gov.br; (45) 3321-2020; 85816-013; Rua Parana;5000; s/n; Centro; Cascavel; PR; CLIENTE; NADA; ATIVO; 13/02/2026
28.542.210/0001-55; JURIDICA; UASG 985821 - MUNICIPIO DE CASIMIRO DE ABREU; PREFEITURA CASIMIRO; ISENTO; licitacoes@casimirodeabreu.rj.gov.br; (22) 2778-1111; 28860-000; Rua Padre Anchieta;234; s/n; Centro; Casimiro de Abreu; RJ; CLIENTE; NADA; ATIVO; 13/02/2026
24.122.111/0001-34; JURIDICA; UASG 984161 - MUNICIPIO DE CASSIA; PREFEITURA CASSIA; ISENTO; licitacoes@cassia.mg.gov.br; (35) 3541-1100; 37980-000; Praca JK; s/n; s/n; Centro; Cassia; MG; CLIENTE; NADA; ATIVO; 13/02/2026
31.428.110/0001-27; JURIDICA; UASG 982607 - MUNICIPIO DE CASTELO; PREFEITURA CASTELO; ISENTO; licitacoes@castelo.es.gov.br; (28) 3542-6300; 29360-000; Rua Carlos de Freitas Lima;120; s/n; Centro; Castelo; ES; CLIENTE; NADA; ATIVO; 13/02/2026
76.205.262/0001-24; JURIDICA; UASG 987487 - MUNICIPIO DE CASTRO; PREFEITURA CASTRO; ISENTO; licitacao@castro.pr.gov.br; (42) 2122-5000; 84165-000; Praca Pedro Kaled;22; s/n; Centro; Castro; PR; CLIENTE; NADA; ATIVO; 13/02/2026
24.233.222/0001-45; JURIDICA; UASG 984163 - MUNICIPIO DE CATAGUASES; PREFEITURA CATAGUASES; ISENTO; licitacoes@cataguases.mg.gov.br; (32) 3422-1000; 36770-000; Praca Santa Rita; s/n; s/n; Centro; Cataguases; MG; CLIENTE; NADA; ATIVO; 13/02/2026
46.524.784/0001-07; JURIDICA; UASG 989221 - MUNICIPIO DE CATANDUVA; PREFEITURA CATANDUVA; ISENTO; licitacoes@catanduva.sp.gov.br; (17) 3311-3000; 15801-316; Praca Conde Francisco Matarazzo;1; s/n; Centro; Catanduva; SP; CLIENTE; NADA; ATIVO; 13/02/2026
00.394.460/0041-39; JURIDICA; UASG 200372 - DELEGACIA DE POLICIA FEDERAL EM CAXIAS DO SUL; POLICIA FEDERAL; ISENTO; compras.cxu.rs@pf.gov.br; (54) 3213-3000; 95052-160; Rua Marcial Pisoni;111; s/n; Santa Catarina; Caxias do Sul; RS; CLIENTE; NADA; ATIVO; 13/02/2026
00.394.494/0114-13; JURIDICA; UASG 170251 - DELEGACIA DA RECEITA FEDERAL CAXIAS DO SUL; RECEITA FEDERAL; ISENTO; licitacoes.cxu.rfb@rfb.gov.br; (54) 3213-3000; 95052-160; Rua Marcial Pisoni;111; s/n; Santa Catarina; Caxias do Sul; RS; CLIENTE; NADA; ATIVO; 13/02/2026
10.863.368/0002-11; JURIDICA; UASG 158459 - IFRS CAMPUS CAXIAS DO SUL; INSTITUTO FEDERAL; ISENTO; compras.caxias@ifrs.edu.br; (54) 3204-2100; 95043-700; Rua Francisco Getulio Vargas;1130; s/n; Petropolis; Caxias do Sul; RS; CLIENTE; NADA; ATIVO; 13/02/2026
88.067.780/0001-01; JURIDICA; UASG 984537 - MUNICIPIO DE CAXIAS DO SUL; PREFEITURA CAXIAS; ISENTO; licitacoes@caxias.rs.gov.br; (54) 3218-6000; 95041-310; Rua Alfredo Chaves;1333; s/n; Centro; Caxias do Sul; RS; CLIENTE; NADA; ATIVO; 13/02/2026
76.204.588/0001-00; JURIDICA; UASG 987553 - MUNICIPIO DE CERRO AZUL; PREFEITURA CERRO AZUL; ISENTO; licitacao@cerroazul.pr.gov.br; (41) 3662-1122; 83510-000; Rua Marechal Floriano Peixoto;111; s/n; Centro; Cerro Azul; PR; CLIENTE; NADA; ATIVO; 13/02/2026
96.519.888/0001-12; JURIDICA; UASG 984869 - MUNICIPIO DE CERRO LARGO; PREFEITURA CERRO LARGO; ISENTO; licitacoes@cerrolargo.rs.gov.br; (55) 3359-4900; 97900-000; Rua Cel. Jorge Frantz; s/n; s/n; Centro; Cerro Largo; RS; CLIENTE; NADA; ATIVO; 13/02/2026
96.619.999/0001-23; JURIDICA; UASG 984871 - MUNICIPIO DE CHARQUEADAS; PREFEITURA CHARQUEADAS; ISENTO; licitacoes@charqueadas.rs.gov.br; (51) 3958-8400; 96745-000; Avenida Dr. Jose Athanasio;120; s/n; Centro; Charqueadas; RS; CLIENTE; NADA; ATIVO; 13/02/2026
76.205.445/0001-40; JURIDICA; UASG 987495 - MUNICIPIO DE CIANORTE; PREFEITURA CIANORTE; ISENTO; licitacao@cianorte.pr.gov.br; (44) 3619-6200; 87200-000; Centro Civico;100; s/n; Centro; Cianorte; PR; CLIENTE; NADA; ATIVO; 13/02/2026
27.167.428/0001-18; JURIDICA; UASG 982575 - MUNICIPIO DE COLATINA; PREFEITURA COLATINA; ISENTO; licitacoes@colatina.es.gov.br; (27) 3177-7000; 29700-010; Avenida Angelo Giuberti;343; s/n; Esplanada; Colatina; ES; CLIENTE; NADA; ATIVO; 13/02/2026
76.105.678/0001-32; JURIDICA; UASG 987501 - MUNICIPIO DE COLOMBO; PREFEITURA COLOMBO; ISENTO; licitacao@colombo.pr.gov.br; (41) 3656-8000; 83414-000; Rua XV de Novembro;105; s/n; Centro; Colombo; PR; CLIENTE; NADA; ATIVO; 13/02/2026
31.428.110/0001-28; JURIDICA; UASG 982609 - MUNICIPIO DE CONCEICAO DA BARRA; PREFEITURA BARRA; ISENTO; licitacoes@conceicaodabarra.es.gov.br; (27) 3762-1100; 29960-000; Praca da Matriz; s/n; s/n; Centro; Conceicao da Barra; ES; CLIENTE; NADA; ATIVO; 13/02/2026
24.344.333/0001-56; JURIDICA; UASG 984165 - MUNICIPIO DE CONCEICAO DAS ALAGOAS; PREFEITURA CONCEICAO; ISENTO; licitacoes@conceicaodasalagoas.mg.gov.br; (34) 3321-0000; 38120-000; Praca Jose de Resende; s/n; s/n; Centro; Conceicao das Alagoas; MG; CLIENTE; NADA; ATIVO; 13/02/2026
31.428.110/0001-29; JURIDICA; UASG 982611 - MUNICIPIO DE CONCEICAO DO CASTELO; PREFEITURA C CASTELO; ISENTO; licitacoes@conceicaodocastelo.es.gov.br; (28) 3547-1101; 29370-000; Avenida Jose Grilo; s/n; s/n; Centro; Conceicao do Castelo; ES; CLIENTE; NADA; ATIVO; 13/02/2026
18.566.656/0001-45; JURIDICA; UASG 984233 - MUNICIPIO DE CONSELHEIRO LAFAIETE; PREFEITURA C LAFAIETE; ISENTO; licitacoes@conselheirolafaiete.mg.gov.br; (31) 3769-2500; 36400-000; Praca Chiquito Furtado; s/n; s/n; Centro; Conselheiro Lafaiete; MG; CLIENTE; NADA; ATIVO; 13/02/2026
24.455.444/0001-67; JURIDICA; UASG 984167 - MUNICIPIO DE CONSELHEIRO PENA; PREFEITURA C PENA; ISENTO; licitacoes@conselheiropena.mg.gov.br; (33) 3261-1200; 35240-000; Praca Joao Luiz da Silva; s/n; s/n; Centro; Conselheiro Pena; MG; CLIENTE; NADA; ATIVO; 13/02/2026
17.625.609/0001-28; JURIDICA; UASG 984313 - MUNICIPIO DE CONTAGEM; PREFEITURA CONTAGEM; ISENTO; licitacoes@contagem.mg.gov.br; (31) 3352-5000; 32041-000; Praca Tancredo Neves;200; s/n; Camargos; Contagem; MG; CLIENTE; NADA; ATIVO; 13/02/2026
20.901.234/0001-11; JURIDICA; UASG 158148 - IFMG CAMPUS CONTAGEM; IFMG; ISENTO; compras.contagem@ifmg.edu.br; (31) 2102-3400; 32145-270; Rua General Lucio de Medeiros;230; s/n; Ressaca; Contagem; MG; CLIENTE; NADA; ATIVO; 13/02/2026
28.544.311/0001-01; JURIDICA; UASG 985823 - MUNICIPIO DE CORDEIRO; PREFEITURA CORDEIRO; ISENTO; licitacoes@cordeiro.rj.gov.br; (22) 2551-0145; 28540-000; Avenida Raul Veiga;123; s/n; Centro; Cordeiro; RJ; CLIENTE; NADA; ATIVO; 13/02/2026
78.206.300/0006-36; JURIDICA; UASG 154366 - UTFPR CAMPUS CORNELIO PROCOPIO; UNIVERSIDADE FEDERAL; ISENTO; compras.cp@utfpr.edu.br; (43) 3520-4000; 86300-000; Avenida Alberto Carazzai;1640; s/n; Centro; Cornelio Procopio; PR; CLIENTE; NADA; ATIVO; 13/02/2026
18.612.223/0001-45; JURIDICA; UASG 984311 - MUNICIPIO DE CORONEL FABRICIANO; PREFEITURA C FABRICIANO; ISENTO; licitacoes@fabriciano.mg.gov.br; (31) 3846-7000; 35170-001; Praca Louis Ensch; s/n; s/n; Centro; Coronel Fabriciano; MG; CLIENTE; NADA; ATIVO; 13/02/2026
46.525.187/0001-90; JURIDICA; UASG 989261 - MUNICIPIO DE COSMOPOLIS; PREFEITURA COSMOPOLIS; ISENTO; licitacoes@cosmopolis.sp.gov.br; (19) 3812-8000; 13150-000; Rua Doutor Campos Salles;398; s/n; Centro; Cosmopolis; SP; CLIENTE; NADA; ATIVO; 13/02/2026
46.523.628/0001-56; JURIDICA; UASG 989147 - MUNICIPIO DE COTIA; PREFEITURA COTIA; ISENTO; licitacoes@cotia.sp.gov.br; (11) 4615-8300; 06700-158; Avenida Professor Manoel Jose Pedroso;1347; s/n; Jardim Nomura; Cotia; SP; CLIENTE; NADA; ATIVO; 13/02/2026
24.566.555/0001-78; JURIDICA; UASG 984169 - MUNICIPIO DE CRISTINA; PREFEITURA CRISTINA; ISENTO; licitacoes@cristina.mg.gov.br; (35) 3663-1100; 37476-000; Praca Santo Antonio; s/n; s/n; Centro; Cristina; MG; CLIENTE; NADA; ATIVO; 13/02/2026
91.914.777/0001-56; JURIDICA; UASG 984517 - MUNICIPIO DE CRUZ ALTA; PREFEITURA C ALTA; ISENTO; licitacoes@cruzalta.rs.gov.br; (55) 3321-1300; 98005-001; Avenida General Osorio;533; s/n; Centro; Cruz Alta; RS; CLIENTE; NADA; ATIVO; 13/02/2026
87.613.063/0001-22; JURIDICA; UASG 984557 - MUNICIPIO DE CRUZ ALTA; PREFEITURA CRUZ ALTA; ISENTO; licitacao@cruzalta.rs.gov.br; (55) 3321-1300; 98005-000; Avenida General Osorio;533; s/n; Centro; Cruz Alta; RS; CLIENTE; NADA; ATIVO; 13/02/2026
46.525.047/0001-85; JURIDICA; UASG 989247 - MUNICIPIO DE CRUZEIRO; PREFEITURA CRUZEIRO; ISENTO; licitacoes@cruzeiro.sp.gov.br; (12) 3141-1100; 12701-010; Avenida Major Novaes;499; s/n; Centro; Cruzeiro; SP; CLIENTE; NADA; ATIVO; 13/02/2026
46.524.120/0001-01; JURIDICA; UASG 989197 - MUNICIPIO DE CUBATAO; PREFEITURA CUBATAO; ISENTO; licitacoes@cubatao.sp.gov.br; (13) 3362-6000; 11500-000; Praca dos Emancipadores; s/n; s/n; Centro; Cubatao; SP; CLIENTE; NADA; ATIVO; 13/02/2026
46.524.187/0001-36; JURIDICA; UASG 158122 - IFSP CAMPUS CUBATAO; INSTITUTO FEDERAL; ISENTO; compras.cub@ifsp.edu.br; (13) 3346-5300; 11533-160; Rua Maria Cristina;50; s/n; Casqueiro; Cubatao; SP; CLIENTE; NADA; ATIVO; 13/02/2026
00.038.166/0012-50; JURIDICA; UASG 080013 - TRIBUNAL REGIONAL DO TRABALHO DA 9 REGIAO; TRT 9; ISENTO; licitacao@trt9.jus.br; (41) 3310-7000; 80410-010; Alameda Doutor Carlos de Carvalho;528; s/n; Centro; Curitiba; PR; CLIENTE; NADA; ATIVO; 13/02/2026
00.394.411/0012-61; JURIDICA; UASG 070019 - TRIBUNAL REGIONAL ELEITORAL DO PARANA; TRE PR; ISENTO; licitacao@tre-pr.jus.br; (41) 3330-8500; 80220-210; Rua Joao Parolin;224; s/n; Prado Velho; Curitiba; PR; CLIENTE; NADA; ATIVO; 13/02/2026
00.394.460/0015-34; JURIDICA; UASG 200373 - SUPERINTENDENCIA REGIONAL POLICIA FEDERAL PR; POLICIA FEDERAL; ISENTO; compras.srpr@pf.gov.br; (41) 3251-7500; 82600-000; Rua Jose Kloss;10; s/n; Santa Candida; Curitiba; PR; CLIENTE; NADA; ATIVO; 13/02/2026
00.394.494/0013-70; JURIDICA; UASG 170025 - SUPERINTENDENCIA RECEITA FEDERAL 9RF; RECEITA FEDERAL; ISENTO; licitacoes.pr.rfb@rfb.gov.br; (41) 3213-1000; 80060-130; Rua Marechal Deodoro;555; s/n; Centro; Curitiba; PR; CLIENTE; NADA; ATIVO; 13/02/2026
00.394.502/0014-44; JURIDICA; UASG 120018 - JUSTICA FEDERAL DO PARANA; JFPR; ISENTO; compras@jfpr.jus.br; (41) 3210-1300; 80030-230; Avenida Anita Garibaldi;888; s/n;; Curitiba; PR; CLIENTE; NADA; ATIVO; 13/02/2026
01.442.222/0018-83; JURIDICA; UASG 160102 - COMANDO DA 5 REGIAO MILITAR; EXERCITO BRASILEIRO; ISENTO; licitacoes@5rm.eb.mil.br; (41) 3316-4800; 80010-160; Rua 24 de Maio;156; s/n; Centro; Curitiba; PR; CLIENTE; NADA; ATIVO; 13/02/2026
01.442.222/0019-64; JURIDICA; UASG 160410 - COLEGIO MILITAR DE CURITIBA; CMC; ISENTO; compras@cmc.eb.mil.br; (41) 3361-3000; 82510-000; Praca das Nacoes; s/n; s/n; Taruma; Curitiba; PR; CLIENTE; NADA; ATIVO; 13/02/2026
01.442.222/0020-06; JURIDICA; UASG 160411 - HOSPITAL MILITAR DE AREA DE CURITIBA; HMAC; ISENTO; compras@hmac.eb.mil.br; (41) 3281-7500; 80230-010; Avenida Vicente Machado;585; s/n; Batel; Curitiba; PR; CLIENTE; NADA; ATIVO; 13/02/2026
01.442.222/0021-97; JURIDICA; UASG 160412 - 5 BATALHAO LOGISTICO; EXERCITO BRASILEIRO; ISENTO; licitacoes.5blog@eb.mil.br; (41) 3316-4800; 80010-160; Avenida Republica Argentina; s/n; s/n; Pinheirinho; Curitiba; PR; CLIENTE; NADA; ATIVO; 13/02/2026
10.727.228/0001-41; JURIDICA; UASG 158129 - INSTITUTO FEDERAL DO PARANA; IFPR; ISENTO; compras@ifpr.edu.br; (41) 3595-7600; 80215-090; Rua Emilio Bertolini;54; s/n; Cajuru; Curitiba; PR; CLIENTE; NADA; ATIVO; 13/02/2026
10.727.228/0006-56; JURIDICA; UASG 158477 - IFPR CAMPUS CURITIBA; INSTITUTO FEDERAL; ISENTO; compras.curitiba@ifpr.edu.br; (41) 3331-9400; 80210-210; Rua Joao Negrao;1285; s/n; Reboucas; Curitiba; PR; CLIENTE; NADA; ATIVO; 13/02/2026
75.026.552/0001-02; JURIDICA; UASG 153079 - UNIVERSIDADE FEDERAL DO PARANA; UFPR; ISENTO; licitacoes@ufpr.br; (41) 3360-5000; 80060-000; Rua XV de Novembro;1299; Reitoria; Centro; Curitiba; PR; CLIENTE; NADA; ATIVO; 13/02/2026
75.026.552/0002-85; JURIDICA; UASG 153080 - HOSPITAL DE CLINICAS DA UFPR; HC UFPR; ISENTO; licitacao.chc@ebserh.gov.br; (41) 3360-1800; 80060-240; Rua General Carneiro;181; s/n; Alto da Gloria; Curitiba; PR; CLIENTE; NADA; ATIVO; 13/02/2026
75.435.845/0001-22; JURIDICA; UASG 987483 - MUNICIPIO DE CURITIBA; PREFEITURA CURITIBA; ISENTO; licitacoes@curitiba.pr.gov.br; (41) 3350-8484; 80020-300; Avenida Candido de Abreu;817; s/n; Centro Civico; Curitiba; PR; CLIENTE; NADA; ATIVO; 13/02/2026
78.206.300/0001-21; JURIDICA; UASG 153251 - UNIVERSIDADE TECNOLOGICA FEDERAL DO PARANA; UTFPR; ISENTO; licitacoes@utfpr.edu.br; (41) 3310-4545; 80230-901; Avenida Sete de Setembro;3165; s/n; Reboucas; Curitiba; PR; CLIENTE; NADA; ATIVO; 13/02/2026
24.677.666/0001-89; JURIDICA; UASG 984171 - MUNICIPIO DE CURVELO; PREFEITURA CURVELO; ISENTO; licitacoes@curvelo.mg.gov.br; (38) 3721-4400; 35790-000; Praca Central; s/n; s/n; Centro; Curvelo; MG; CLIENTE; NADA; ATIVO; 13/02/2026
46.523.420/0001-37; JURIDICA; UASG 989127 - MUNICIPIO DE DIADEMA; PREFEITURA DIADEMA; ISENTO; licitacoes@diadema.sp.gov.br; (11) 4057-7700; 09911-130; Rua Almirante Barroso;111; s/n; Vila Santa Dirce; Diadema; SP; CLIENTE; NADA; ATIVO; 13/02/2026
18.844.333/0001-23; JURIDICA; UASG 984335 - MUNICIPIO DE DIAMANTINA; PREFEITURA DIAMANTINA; ISENTO; licitacoes@diamantina.mg.gov.br; (38) 3531-9500; 39100-000; Rua da Gloria;394; s/n; Centro; Diamantina; MG; CLIENTE; NADA; ATIVO; 13/02/2026
20.890.123/0001-22; JURIDICA; UASG 153038 - UNIVERSIDADE FEDERAL DOS VALES DO JEQUITINHONHA; UFVJM; ISENTO; compras@ufvjm.edu.br; (38) 3532-1200; 39100-000; Rodovia MGT 367; s/n; km 583; Alto da Jacuba; Diamantina; MG; CLIENTE; NADA; ATIVO; 13/02/2026
31.428.110/0001-30; JURIDICA; UASG 982613 - MUNICIPIO DE DIVINO DE SAO LOURENCO; PREFEITURA DIVINO; ISENTO; licitacoes@dslourenco.es.gov.br; (28) 3551-1100; 29590-000; Praca Principal; s/n; s/n; Centro; Divino de Sao Lourenco; ES; CLIENTE; NADA; ATIVO; 13/02/2026
18.451.344/0001-23; JURIDICA; UASG 984333 - MUNICIPIO DE DIVINOPOLIS; PREFEITURA DIVINOPOLIS; ISENTO; licitacoes@divinopolis.mg.gov.br; (37) 3229-8100; 35500-006; Rua Pernambuco;60; s/n; Centro; Divinopolis; MG; CLIENTE; NADA; ATIVO; 13/02/2026
96.720.111/0001-34; JURIDICA; UASG 984873 - MUNICIPIO DE DOM PEDRITO; PREFEITURA DOM PEDRITO; ISENTO; licitacoes@dompedrito.rs.gov.br; (53) 3243-3177; 96450-000; Rua Bernardino Angelo; s/n; s/n; Centro; Dom Pedrito; RS; CLIENTE; NADA; ATIVO; 13/02/2026
31.428.110/0001-31; JURIDICA; UASG 982615 - MUNICIPIO DE DOMINGOS MARTINS; PREFEITURA D MARTINS; ISENTO; licitacoes@domingosmartins.es.gov.br; (27) 3268-1200; 29260-000; Rua Bernardino Monteiro; s/n; s/n; Centro; Domingos Martins; ES; CLIENTE; NADA; ATIVO; 13/02/2026
31.428.110/0001-32; JURIDICA; UASG 982617 - MUNICIPIO DE DORES DO RIO PRETO; PREFEITURA DORES; ISENTO; licitacoes@drpreto.es.gov.br; (28) 3559-1100; 29580-000; Praca da Matriz; s/n; s/n; Centro; Dores do Rio Preto; ES; CLIENTE; NADA; ATIVO; 13/02/2026
28.546.412/0001-40; JURIDICA; UASG 985825 - MUNICIPIO DE DUAS BARRAS; PREFEITURA DUAS BARRAS; ISENTO; licitacoes@duasbarras.rj.gov.br; (22) 2534-1212; 28520-000; Praca Governador Portela;7; s/n; Centro; Duas Barras; RJ; CLIENTE; NADA; ATIVO; 13/02/2026
00.394.502/0015-40; JURIDICA; UASG 120056 - JUSTICA FEDERAL DUQUE DE CAXIAS; JUSTICA FEDERAL; ISENTO; compras.dca@jfrj.jus.br; (21) 3675-3100; 25071-202;Alameda Esmeralda;206; s/n; Jardim Primavera; Duque de Caxias; RJ; CLIENTE; NADA; ATIVO; 13/02/2026
10.851.211/0002-23; JURIDICA; UASG 158438 - IFRJ CAMPUS DUQUE DE CAXIAS; INSTITUTO FEDERAL; ISENTO; compras.dc@ifrj.edu.br; (21) 2671-2990; 25050-100;Rua Republica do Paraguai; s/n; s/n; Vila Sarapui; Duque de Caxias; RJ; CLIENTE; NADA; ATIVO; 13/02/2026
28.521.573/0001-80; JURIDICA; UASG 985741 - MUNICIPIO DE DUQUE DE CAXIAS; PREFEITURA CAXIAS; ISENTO; licitacao@duquedecaxias.rj.gov.br; (21) 2773-6200; 25071-202;Alameda Esmeralda;206; s/n; Jardim Primavera; Duque de Caxias; RJ; CLIENTE; NADA; ATIVO; 12/02/2026
